2025-06-08 01:09:27.174165 eth2  In  IP 172.172.10.10 > 172.172.10.2: ICMP echo request, id 4, seq 29, length 64
2025-06-08 01:09:27.174182 eth2  Out IP 172.172.10.2 > 172.172.10.10: ICMP echo reply, id 4, seq 29, length 64
2025-06-08 01:09:28.198179 eth2  In  IP 172.172.10.10 > 172.172.10.2: ICMP echo request, id 4, seq 30, length 64
2025-06-08 01:09:28.198197 eth2  Out IP 172.172.10.2 > 172.172.10.10: ICMP echo reply, id 4, seq 30, length 64
2025-06-08 01:09:29.222142 eth2  In  IP 172.172.10.10 > 172.172.10.2: ICMP echo request, id 4, seq 31, length 64
2025-06-08 01:09:29.222158 eth2  Out IP 172.172.10.2 > 172.172.10.10: ICMP echo reply, id 4, seq 31, length 64
2025-06-08 01:09:30.246131 eth2  In  IP 172.172.10.10 > 172.172.10.2: ICMP echo request, id 4, seq 32, length 64
2025-06-08 01:09:30.246146 eth2  Out IP 172.172.10.2 > 172.172.10.10: ICMP echo reply, id 4, seq 32, length 64
2025-06-08 01:09:31.270160 eth2  In  IP 172.172.10.10 > 172.172.10.2: ICMP echo request, id 4, seq 33, length 64
2025-06-08 01:09:31.270177 eth2  Out IP 172.172.10.2 > 172.172.10.10: ICMP echo reply, id 4, seq 33, length 64
2025-06-08 01:09:32.294128 eth2  In  IP 172.172.10.10 > 172.172.10.2: ICMP echo request, id 4, seq 34, length 64
2025-06-08 01:09:32.294142 eth2  Out IP 172.172.10.2 > 172.172.10.10: ICMP echo reply, id 4, seq 34, length 64
2025-06-08 01:09:33.318194 eth2  In  IP 172.172.10.10 > 172.172.10.2: ICMP echo request, id 4, seq 35, length 64
2025-06-08 01:09:33.318212 eth2  Out IP 172.172.10.2 > 172.172.10.10: ICMP echo reply, id 4, seq 35, length 64
2025-06-08 01:09:34.342175 eth2  In  IP 172.172.10.10 > 172.172.10.2: ICMP echo request, id 4, seq 36, length 64
2025-06-08 01:09:34.342192 eth2  Out IP 172.172.10.2 > 172.172.10.10: ICMP echo reply, id 4, seq 36, length 64
2025-06-08 01:09:35.366163 eth2  In  IP 172.172.10.10 > 172.172.10.2: ICMP echo request, id 4, seq 37, length 64
2025-06-08 01:09:35.366179 eth2  Out IP 172.172.10.2 > 172.172.10.10: ICMP echo reply, id 4, seq 37, length 64
2025-06-08 01:09:36.390115 eth2  In  IP 172.172.10.10 > 172.172.10.2: ICMP echo request, id 4, seq 38, length 64
2025-06-08 01:09:36.390130 eth2  Out IP 172.172.10.2 > 172.172.10.10: ICMP echo reply, id 4, seq 38, length 64
2025-06-08 01:09:37.414147 eth2  In  IP 172.172.10.10 > 172.172.10.2: ICMP echo request, id 4, seq 39, length 64
2025-06-08 01:09:37.414163 eth2  Out IP 172.172.10.2 > 172.172.10.10: ICMP echo reply, id 4, seq 39, length 64
2025-06-08 01:09:38.438152 eth2  In  IP 172.172.10.10 > 172.172.10.2: ICMP echo request, id 4, seq 40, length 64
2025-06-08 01:09:38.438171 eth2  Out IP 172.172.10.2 > 172.172.10.10: ICMP echo reply, id 4, seq 40, length 64
2025-06-08 01:09:39.462137 eth2  In  IP 172.172.10.10 > 172.172.10.2: ICMP echo request, id 4, seq 41, length 64
2025-06-08 01:09:39.462155 eth2  Out IP 172.172.10.2 > 172.172.10.10: ICMP echo reply, id 4, seq 41, length 64
2025-06-08 01:09:40.486177 eth2  In  IP 172.172.10.10 > 172.172.10.2: ICMP echo request, id 4, seq 42, length 64
2025-06-08 01:09:40.486195 eth2  Out IP 172.172.10.2 > 172.172.10.10: ICMP echo reply, id 4, seq 42, length 64
2025-06-08 01:09:41.510138 eth2  In  IP 172.172.10.10 > 172.172.10.2: ICMP echo request, id 4, seq 43, length 64
2025-06-08 01:09:41.510154 eth2  Out IP 172.172.10.2 > 172.172.10.10: ICMP echo reply, id 4, seq 43, length 64
2025-06-08 01:09:42.533269 eth2  In  IP 172.172.10.10 > 172.172.10.2: ICMP echo request, id 4, seq 44, length 64
2025-06-08 01:09:42.533286 eth2  Out IP 172.172.10.2 > 172.172.10.10: ICMP echo reply, id 4, seq 44, length 64
2025-06-08 01:09:43.557285 eth2  In  IP 172.172.10.10 > 172.172.10.2: ICMP echo request, id 4, seq 45, length 64
2025-06-08 01:09:43.557302 eth2  Out IP 172.172.10.2 > 172.172.10.10: ICMP echo reply, id 4, seq 45, length 64
2025-06-08 01:09:44.581244 eth2  In  IP 172.172.10.10 > 172.172.10.2: ICMP echo request, id 4, seq 46, length 64
2025-06-08 01:09:44.581262 eth2  Out IP 172.172.10.2 > 172.172.10.10: ICMP echo reply, id 4, seq 46, length 64
2025-06-08 01:09:45.605252 eth2  In  IP 172.172.10.10 > 172.172.10.2: ICMP echo request, id 4, seq 47, length 64
2025-06-08 01:09:45.605270 eth2  Out IP 172.172.10.2 > 172.172.10.10: ICMP echo reply, id 4, seq 47, length 64
2025-06-08 01:09:46.629271 eth2  In  IP 172.172.10.10 > 172.172.10.2: ICMP echo request, id 4, seq 48, length 64
2025-06-08 01:09:46.629289 eth2  Out IP 172.172.10.2 > 172.172.10.10: ICMP echo reply, id 4, seq 48, length 64
2025-06-08 01:09:47.557202 eth2  In  ARP, Request who-has 172.172.10.2 tell 172.172.10.10, length 28
2025-06-08 01:09:47.557210 eth2  Out ARP, Reply 172.172.10.2 is-at 0a:ab:45:52:24:84, length 28
2025-06-08 01:09:47.653229 eth2  In  IP 172.172.10.10 > 172.172.10.2: ICMP echo request, id 4, seq 49, length 64
2025-06-08 01:09:47.653242 eth2  Out IP 172.172.10.2 > 172.172.10.10: ICMP echo reply, id 4, seq 49, length 64
2025-06-08 01:09:48.677239 eth2  In  IP 172.172.10.10 > 172.172.10.2: ICMP echo request, id 4, seq 50, length 64
2025-06-08 01:09:48.677255 eth2  Out IP 172.172.10.2 > 172.172.10.10: ICMP echo reply, id 4, seq 50, length 64
2025-06-08 01:09:49.605183 eth2  Out ARP, Request who-has 172.172.10.10 tell 172.172.10.2, length 28
2025-06-08 01:09:49.605221 eth2  In  ARP, Reply 172.172.10.10 is-at d2:92:1e:d4:19:b2, length 28
2025-06-08 01:09:49.701236 eth2  In  IP 172.172.10.10 > 172.172.10.2: ICMP echo request, id 4, seq 51, length 64
2025-06-08 01:09:49.701252 eth2  Out IP 172.172.10.2 > 172.172.10.10: ICMP echo reply, id 4, seq 51, length 64
2025-06-08 01:09:50.725246 eth2  In  IP 172.172.10.10 > 172.172.10.2: ICMP echo request, id 4, seq 52, length 64
2025-06-08 01:09:50.725263 eth2  Out IP 172.172.10.2 > 172.172.10.10: ICMP echo reply, id 4, seq 52, length 64
2025-06-08 01:09:51.749261 eth2  In  IP 172.172.10.10 > 172.172.10.2: ICMP echo request, id 4, seq 53, length 64
2025-06-08 01:09:51.749277 eth2  Out IP 172.172.10.2 > 172.172.10.10: ICMP echo reply, id 4, seq 53, length 64
2025-06-08 01:09:52.773245 eth2  In  IP 172.172.10.10 > 172.172.10.2: ICMP echo request, id 4, seq 54, length 64
2025-06-08 01:09:52.773263 eth2  Out IP 172.172.10.2 > 172.172.10.10: ICMP echo reply, id 4, seq 54, length 64
2025-06-08 01:09:53.797277 eth2  In  IP 172.172.10.10 > 172.172.10.2: ICMP echo request, id 4, seq 55, length 64
2025-06-08 01:09:53.797296 eth2  Out IP 172.172.10.2 > 172.172.10.10: ICMP echo reply, id 4, seq 55, length 64
2025-06-08 01:09:54.821242 eth2  In  IP 172.172.10.10 > 172.172.10.2: ICMP echo request, id 4, seq 56, length 64
2025-06-08 01:09:54.821261 eth2  Out IP 172.172.10.2 > 172.172.10.10: ICMP echo reply, id 4, seq 56, length 64
2025-06-08 01:09:55.845264 eth2  In  IP 172.172.10.10 > 172.172.10.2: ICMP echo request, id 4, seq 57, length 64
2025-06-08 01:09:55.845285 eth2  Out IP 172.172.10.2 > 172.172.10.10: ICMP echo reply, id 4, seq 57, length 64

